{
  "confidence": "explicit",
  "createdAt": "2020-02-25T00:00:00Z",
  "createdBy": {
    "actorId": "shreyash",
    "actorType": "human"
  },
  "description": "The OMFV must protect the crew and Soldiers from emerging threats and CBRN environments. The OMFV should reduce likelihood of detection by minimizing thermal, visual, and acoustic signatures.",
  "id": "obj-survivability",
  "ingestionProvenance": {
    "extractedAt": "2026-09-06",
    "extractor": "human",
    "locator": "section 'OMFV Characteristics: Objectives', Survivability (characteristic text); sources/army-2020-04-09-omfv-industry-day-narrative.pdf p. 6 section 3.2 (priorityRank 1)",
    "sourceArtifact": "sources/army-2020-02-25-omfv-characteristics-for-industry-comment.md"
  },
  "name": "Survivability",
  "priority": "primary",
  "priorityRank": 1,
  "provenance": "ev-con-2020-02",
  "rev": 1,
  "type": "Objective"
}
