{
  "confidence": "explicit",
  "createdAt": "2020-02-25T00:00:00Z",
  "createdBy": {
    "actorId": "shreyash",
    "actorType": "human"
  },
  "description": "The OMFV should contain embedded training capabilities that are compatible with the Synthetic Training Environment (STE).",
  "id": "obj-training",
  "ingestionProvenance": {
    "extractedAt": "2026-09-06",
    "extractor": "human",
    "locator": "section 'OMFV Characteristics: Objectives', Training (characteristic text); sources/army-2020-04-09-omfv-industry-day-narrative.pdf p. 6 section 3.2 (priorityRank 9)",
    "sourceArtifact": "sources/army-2020-02-25-omfv-characteristics-for-industry-comment.md"
  },
  "name": "Training",
  "priority": "primary",
  "priorityRank": 9,
  "provenance": "ev-con-2020-02",
  "rev": 1,
  "type": "Objective"
}
